{
  "$schema": "https://json-schema.org/draft/2020-12/schema",
  "$id": "https://raw.githubusercontent.com/stauntonjr/agentic-application-assessor/main/schemas/application-assessment-report.schema.json",
  "title": "Agentic Application Assessor report",
  "type": "object",
  "additionalProperties": false,
  "required": ["schema_version", "tool", "target", "inputs", "coverage", "evidence", "claims", "contradictions", "unknowns"],
  "properties": {
    "schema_version": {"const": "1.0"},
    "tool": {"type": "object", "additionalProperties": false, "required": ["name", "version"], "properties": {"name": {"const": "agentic-application-assessor"}, "version": {"type": "string"}}},
    "target": {"type": "object", "additionalProperties": false, "required": ["name", "revision", "branch", "dirty", "state_id"], "properties": {"name": {"type": "string", "minLength": 1}, "revision": {"type": "string", "pattern": "^(?:[0-9a-f]{40}|[0-9a-f]{64})$"}, "branch": {"type": "string", "minLength": 1}, "dirty": {"type": "boolean"}, "state_id": {"type": "string", "pattern": "^sha256:[0-9a-f]{64}$"}}},
    "inputs": {"type": "object", "additionalProperties": false, "required": ["context", "agentic_repo_auditor"], "properties": {"context": {"type": "object", "additionalProperties": false, "required": ["path", "sha256", "schema_version"], "properties": {"path": {"type": "string", "minLength": 1}, "sha256": {"type": "string", "pattern": "^[0-9a-f]{64}$"}, "schema_version": {"enum": ["1.0", "1.1"]}}}, "agentic_repo_auditor": {"oneOf": [{"type": "null"}, {"$ref": "#/$defs/auditorInput"}]}}},
    "coverage": {"type": "object", "additionalProperties": {"type": "integer", "minimum": 0}},
    "evidence": {"type": "array", "items": {"$ref": "#/$defs/evidence"}},
    "claims": {"type": "array", "items": {"$ref": "#/$defs/claim"}},
    "contradictions": {"type": "array", "items": {"$ref": "#/$defs/claim"}},
    "unknowns": {"type": "array", "items": {"$ref": "#/$defs/claim"}}
  },
  "$defs": {
    "auditorInput": {
      "type": "object",
      "additionalProperties": false,
      "required": ["path", "sha256", "schema_version", "tool", "target"],
      "properties": {
        "path": {"type": "string", "minLength": 1},
        "sha256": {"type": "string", "pattern": "^[0-9a-f]{64}$"},
        "schema_version": {"const": "1.2"},
        "tool": {
          "type": "object",
          "additionalProperties": false,
          "required": ["name", "version"],
          "properties": {
            "name": {"const": "agentic-repo-auditor"},
            "version": {"const": "0.1.0"}
          }
        },
        "target": {
          "type": "object",
          "additionalProperties": false,
          "required": ["name", "revision", "branch", "dirty", "state_id"],
          "properties": {
            "name": {"type": "string", "minLength": 1},
            "revision": {"type": "string", "pattern": "^(?:[0-9a-f]{40}|[0-9a-f]{64})$"},
            "branch": {"type": "string", "minLength": 1},
            "dirty": {"type": "boolean"},
            "state_id": {"type": "string", "pattern": "^sha256:[0-9a-f]{64}$"}
          }
        }
      }
    },
    "origin": {"enum": ["observed", "imported-tool", "human-declared", "derived", "model-synthesized", "unavailable"]},
    "stableId": {"type": "string", "pattern": "^[a-z][a-z0-9-]*(?:\\.[a-z0-9-]+)*$"},
    "evidence": {"type": "object", "additionalProperties": false, "required": ["id", "origin", "kind", "source", "value", "sha256"], "properties": {"id": {"$ref": "#/$defs/stableId"}, "origin": {"$ref": "#/$defs/origin"}, "kind": {"type": "string", "minLength": 1}, "source": {"type": "string", "minLength": 1}, "value": {"type": "string", "minLength": 1}, "sha256": {"type": ["string", "null"], "pattern": "^[0-9a-f]{64}$"}}},
    "claim": {"type": "object", "additionalProperties": false, "required": ["id", "origin", "status", "statement", "source", "evidence_ids"], "properties": {"id": {"$ref": "#/$defs/stableId"}, "origin": {"$ref": "#/$defs/origin"}, "status": {"enum": ["supported", "proposed", "contradicted", "unavailable"]}, "statement": {"type": "string", "minLength": 1}, "source": {"type": "string", "minLength": 1}, "evidence_ids": {"type": "array", "uniqueItems": true, "items": {"$ref": "#/$defs/stableId"}}}}
  }
}
