{
  "claims": [
    {
      "evidence_ids": [
        "context.application.stakeholders"
      ],
      "id": "application.audience",
      "origin": "human-declared",
      "source": "macro-technical-pulse.context.json#/application/stakeholders",
      "statement": "Stakeholders: Jack Rory Staunton, application maintainers, economic and market data researchers, feature-engineering and model developers, model validators, independent risk reviewers",
      "status": "supported"
    },
    {
      "evidence_ids": [
        "context.application.purpose"
      ],
      "id": "application.purpose",
      "origin": "human-declared",
      "source": "macro-technical-pulse.context.json#/application/purpose",
      "statement": "Capture and gather economic and market data streams, store them for feature engineering and machine-learning price-prediction models, deploy trained models on live streams, and provide visualization of the collected data, engineered features, signals, and predictions. Technical-response measurement may later analyze price sensitivity to external signals, but it is not the application's primary purpose.",
      "status": "supported"
    }
  ],
  "contradictions": [],
  "coverage": {
    "documentation": 27,
    "entrypoint": 2,
    "imported-auditor-finding-evidence": 15,
    "imported-auditor-findings": 13,
    "manifest": 1,
    "test": 4
  },
  "evidence": [
    {
      "id": "auditor.artifact",
      "kind": "analysis-artifact",
      "origin": "imported-tool",
      "sha256": "93505fb1c11f7675b155355a2ad9119d68ad5a793b2de7a7e10da31a937b097a",
      "source": "macro-technical-pulse.auditor-report.json#",
      "value": "agentic-repo-auditor 0.1.0 report schema 1.2"
    },
    {
      "id": "auditor.configuration",
      "kind": "repository-audit-configuration",
      "origin": "imported-tool",
      "sha256": "93505fb1c11f7675b155355a2ad9119d68ad5a793b2de7a7e10da31a937b097a",
      "source": "macro-technical-pulse.auditor-report.json#/configuration",
      "value": "{\"disabled_checks\":[],\"evidence\":{\"primary_check\":null,\"project_contract\":null}}"
    },
    {
      "id": "auditor.finding.agent-readiness.instructions",
      "kind": "repository-audit-finding",
      "origin": "imported-tool",
      "sha256": "93505fb1c11f7675b155355a2ad9119d68ad5a793b2de7a7e10da31a937b097a",
      "source": "macro-technical-pulse.auditor-report.json#/findings/0",
      "value": "{\"category\":\"agent-readiness\",\"description\":\"Repository instructions expose core evidence, verification, and safety signals.\",\"id\":\"agent-readiness.instructions\",\"remediation\":\"Document source precedence, tests, verification boundaries, and safety constraints.\",\"severity\":\"medium\",\"status\":\"warn\",\"title\":\"Agent instruction coverage\"}"
    },
    {
      "id": "auditor.finding.agent-readiness.instructions.evidence.0000",
      "kind": "repository-audit-finding-evidence",
      "origin": "imported-tool",
      "sha256": "93505fb1c11f7675b155355a2ad9119d68ad5a793b2de7a7e10da31a937b097a",
      "source": "macro-technical-pulse.auditor-report.json#/findings/0/evidence/0",
      "value": "{\"kind\":\"signal-set\",\"path\":\"AGENTS.md\",\"value\":\"present=['source', 'test', 'verification']; missing=['safety']; matches=['source:sources', 'test:test', 'verification:verified']\"}"
    },
    {
      "id": "auditor.finding.agent-readiness.skills",
      "kind": "repository-audit-finding",
      "origin": "imported-tool",
      "sha256": "93505fb1c11f7675b155355a2ad9119d68ad5a793b2de7a7e10da31a937b097a",
      "source": "macro-technical-pulse.auditor-report.json#/findings/1",
      "value": "{\"category\":\"agent-readiness\",\"description\":\"Repository skills use discoverable SKILL.md files with basic portable metadata.\",\"id\":\"agent-readiness.skills\",\"remediation\":\"Use one skill directory per capability with valid name and description frontmatter.\",\"severity\":\"low\",\"status\":\"warn\",\"title\":\"Portable agent skills\"}"
    },
    {
      "id": "auditor.finding.agent-readiness.skills.evidence.0000",
      "kind": "repository-audit-finding-evidence",
      "origin": "imported-tool",
      "sha256": "93505fb1c11f7675b155355a2ad9119d68ad5a793b2de7a7e10da31a937b097a",
      "source": "macro-technical-pulse.auditor-report.json#/findings/1/evidence/0",
      "value": "{\"kind\":\"path-count\",\"path\":\".agents/skills\",\"value\":\"0\"}"
    },
    {
      "id": "auditor.finding.ci.immutable-actions",
      "kind": "repository-audit-finding",
      "origin": "imported-tool",
      "sha256": "93505fb1c11f7675b155355a2ad9119d68ad5a793b2de7a7e10da31a937b097a",
      "source": "macro-technical-pulse.auditor-report.json#/findings/2",
      "value": "{\"category\":\"ci\",\"description\":\"External Actions and container actions use immutable references.\",\"id\":\"ci.immutable-actions\",\"remediation\":\"Pin third-party Actions to full commit SHAs and containers to image digests.\",\"severity\":\"high\",\"status\":\"fail\",\"title\":\"Immutable workflow dependencies\"}"
    },
    {
      "id": "auditor.finding.ci.immutable-actions.evidence.0000",
      "kind": "repository-audit-finding-evidence",
      "origin": "imported-tool",
      "sha256": "93505fb1c11f7675b155355a2ad9119d68ad5a793b2de7a7e10da31a937b097a",
      "source": "macro-technical-pulse.auditor-report.json#/findings/2/evidence/0",
      "value": "{\"kind\":\"action-summary\",\"path\":\".github/workflows\",\"value\":\"references=2\"}"
    },
    {
      "id": "auditor.finding.ci.immutable-actions.evidence.0001",
      "kind": "repository-audit-finding-evidence",
      "origin": "imported-tool",
      "sha256": "93505fb1c11f7675b155355a2ad9119d68ad5a793b2de7a7e10da31a937b097a",
      "source": "macro-technical-pulse.auditor-report.json#/findings/2/evidence/1",
      "value": "{\"kind\":\"mutable-action\",\"path\":\".github/workflows/ci.yml\",\"value\":\"actions/checkout@v4\"}"
    },
    {
      "id": "auditor.finding.ci.immutable-actions.evidence.0002",
      "kind": "repository-audit-finding-evidence",
      "origin": "imported-tool",
      "sha256": "93505fb1c11f7675b155355a2ad9119d68ad5a793b2de7a7e10da31a937b097a",
      "source": "macro-technical-pulse.auditor-report.json#/findings/2/evidence/2",
      "value": "{\"kind\":\"mutable-action\",\"path\":\".github/workflows/ci.yml\",\"value\":\"actions/setup-python@v5\"}"
    },
    {
      "id": "auditor.finding.ci.workflows",
      "kind": "repository-audit-finding",
      "origin": "imported-tool",
      "sha256": "93505fb1c11f7675b155355a2ad9119d68ad5a793b2de7a7e10da31a937b097a",
      "source": "macro-technical-pulse.auditor-report.json#/findings/3",
      "value": "{\"category\":\"ci\",\"description\":\"At least one repository CI workflow is present.\",\"id\":\"ci.workflows\",\"remediation\":\"Add CI that runs the same authoritative check used locally.\",\"severity\":\"info\",\"status\":\"pass\",\"title\":\"Continuous integration workflows\"}"
    },
    {
      "id": "auditor.finding.ci.workflows.evidence.0000",
      "kind": "repository-audit-finding-evidence",
      "origin": "imported-tool",
      "sha256": "93505fb1c11f7675b155355a2ad9119d68ad5a793b2de7a7e10da31a937b097a",
      "source": "macro-technical-pulse.auditor-report.json#/findings/3/evidence/0",
      "value": "{\"kind\":\"path-count\",\"path\":\".github/workflows\",\"value\":\"1\"}"
    },
    {
      "id": "auditor.finding.git.clean-worktree",
      "kind": "repository-audit-finding",
      "origin": "imported-tool",
      "sha256": "93505fb1c11f7675b155355a2ad9119d68ad5a793b2de7a7e10da31a937b097a",
      "source": "macro-technical-pulse.auditor-report.json#/findings/4",
      "value": "{\"category\":\"git\",\"description\":\"The audit records whether the target has uncommitted or untracked state.\",\"id\":\"git.clean-worktree\",\"remediation\":\"Review and intentionally preserve, commit, or ignore outstanding worktree entries.\",\"severity\":\"info\",\"status\":\"pass\",\"title\":\"Worktree state\"}"
    },
    {
      "id": "auditor.finding.git.clean-worktree.evidence.0000",
      "kind": "repository-audit-finding-evidence",
      "origin": "imported-tool",
      "sha256": "93505fb1c11f7675b155355a2ad9119d68ad5a793b2de7a7e10da31a937b097a",
      "source": "macro-technical-pulse.auditor-report.json#/findings/4/evidence/0",
      "value": "{\"kind\":\"git-status\",\"path\":\".\",\"value\":\"changed_entries=0\"}"
    },
    {
      "id": "auditor.finding.governance.community-files",
      "kind": "repository-audit-finding",
      "origin": "imported-tool",
      "sha256": "93505fb1c11f7675b155355a2ad9119d68ad5a793b2de7a7e10da31a937b097a",
      "source": "macro-technical-pulse.auditor-report.json#/findings/5",
      "value": "{\"category\":\"governance\",\"description\":\"Basic purpose, contribution, and licensing files are present.\",\"id\":\"governance.community-files\",\"remediation\":\"Add the missing community health files and keep them aligned with actual behavior.\",\"severity\":\"low\",\"status\":\"warn\",\"title\":\"Community health files\"}"
    },
    {
      "id": "auditor.finding.governance.community-files.evidence.0000",
      "kind": "repository-audit-finding-evidence",
      "origin": "imported-tool",
      "sha256": "93505fb1c11f7675b155355a2ad9119d68ad5a793b2de7a7e10da31a937b097a",
      "source": "macro-technical-pulse.auditor-report.json#/findings/5/evidence/0",
      "value": "{\"kind\":\"path-set\",\"path\":\".\",\"value\":\"present=['README.md', 'LICENSE']; missing=['CONTRIBUTING.md']\"}"
    },
    {
      "id": "auditor.finding.governance.instructions",
      "kind": "repository-audit-finding",
      "origin": "imported-tool",
      "sha256": "93505fb1c11f7675b155355a2ad9119d68ad5a793b2de7a7e10da31a937b097a",
      "source": "macro-technical-pulse.auditor-report.json#/findings/6",